Investing In Amazon: Not As Safe As You Think,"Jeff Vande HeyThu, Dec. 27, 201849 Comments"
Amazon.com Hasn't Looked This Tempting In A While,"DM Martins ResearchThu, Dec. 27, 201825 Comments"
Has Amazon's Stock Finally Bottomed?,"Mott Capital ManagementWed, Dec. 26, 201849 Comments"
Mark Hibben Positions For 2019: Better Days Ahead For Tech,"Editors' PickMark HibbenWed, Dec. 26, 2018130 Comments"
Amazon's Rational Capitalization Based On EBITDA,"Oleh KombaievMon, Dec. 24, 201821 Comments"
Amazon: Growth Is Far From Over,"Gainsboro CapitalSun, Dec. 23, 201852 Comments"
Amazon Is A Buy As Higher Margins Outweigh Slowing Revenue Growth,"Julian LinMon, Dec. 17, 2018106 Comments"
Amazon Plans To Save Billions With Planes And Vans,"Michael HenageFri, Dec. 14, 201857 Comments"
Amazon Versus All Others: A New Risk Developing?,"GS AnalyticsFri, Dec. 14, 201844 Comments"
Amazon: New Trends Are Not Priced In,"Bluesea ResearchFri, Dec. 14, 201823 Comments"
Amazon AWS Is Poised To Flourish Over The Next Decade,"Eric SpragueFri, Dec. 14, 201836 Comments"
InvestEd: Ep. 192 - What Happened? Amazon And Whole Foods,"Phil TownWed, Dec. 12, 201849 Comments"
Amazon's Next Catalyst,"Louis StevensFri, Dec. 07, 201837 Comments"
Amazon Should Have A Happier Holiday Than Portrayed By Guidance,"Edward AmbroseThu, Dec. 06, 201811 Comments"
Amazon Still Has A Lot Of Growth Potential Driven By Prime,"HiddenValueInvestorThu, Dec. 06, 201826 Comments"
Investing Whiplash: Looking For Closure With Apple And Amazon,"Aswath DamodaranWed, Dec. 05, 201824 Comments"
Amazon: False Signals,"Michael Wiggins De OliveiraTue, Dec. 04, 2018100 Comments"
Amazon Is Hiding A Big Surprise,"Bluesea ResearchThu, Nov. 29, 201888 Comments"
"Retirement Strategies: Amazon And Walmart Head To Head, And A Discussion On Retirement Timing","William SabinWed, Nov. 28, 201832 Comments"
"Amazon.com's Graviton CPU: A New War, A Lost Battle","Paulo SantosWed, Nov. 28, 201857 Comments"
Amazon: Buy The Dip With Both Hands,"MangoTree AnalysisTue, Nov. 27, 201850 Comments"
Walmart Takes On Amazon,"D. H. TaylorTue, Nov. 27, 201847 Comments"
Amazon Looking To Challenge Apple In Payments War,"Bluesea ResearchTue, Nov. 27, 201873 Comments"
Amazon In 2023 With Priya Anand (Podcast),"Editors' PickBehind The IdeaTue, Nov. 27, 2018"
Why We Doubled Our Position In Amazon,"Mark RoussinMon, Nov. 26, 201868 Comments"
Amazon's Correction Spells Long-Term Opportunity,"Michael HenageTue, Nov. 20, 201864 Comments"
Amazon Valuation Part 3: Discount Rates And My Final Valuation,"Billy DubersteinTue, Nov. 20, 201826 Comments"
Aswath Damodaran On Amazon's Limits (Podcast),"Editors' PickBehind The IdeaTue, Nov. 20, 201811 Comments"
Amazon Stock Faces Even Steeper Declines,"Mott Capital ManagementMon, Nov. 19, 201873 Comments"
Amazon's Margins: What Will They Be In 2029?,"Billy DubersteinSun, Nov. 18, 201866 Comments"
Amazon Or Disney: Which Company Should You Buy For Video-Streaming Exposure In India?,"Sankalp SoniSat, Nov. 17, 201817 Comments"
Amazon Valuation Part 1: Revenue Drivers Over The Next Decade,"Billy DubersteinThu, Nov. 15, 201824 Comments"
Amazon Is Delivering Solid Growth In India,"Sankalp SoniThu, Nov. 15, 20188 Comments"
New Ad Kid Amazon Beating Up Facebook And Google,"Elazar Advisors, LLCThu, Nov. 15, 201868 Comments"
Amazon: When Growth Meets Reality,"Michael Wiggins De OliveiraWed, Nov. 14, 201883 Comments"
A Rare Misstep From Amazon,"David PinsenWed, Nov. 14, 2018147 Comments"
RiverPark Large Growth Fund Q3 2018 Performance Summary,"Fund LettersTue, Nov. 13, 20184 Comments"
How To Read Amazon's Financial Statements (Podcast),"Behind The IdeaTue, Nov. 13, 20186 Comments"
Amazon And Irrational Exuberance: Sell For The Long Term,"D. H. TaylorThu, Nov. 08, 2018108 Comments"
Has Amazon Been Hurt By Tariffs?,"Kwan-Chen MaWed, Nov. 07, 201836 Comments"
Amazon's Rational Price,"Oleh KombaievWed, Nov. 07, 201827 Comments"
Amazon's Path To The Everything Company With Brad Stone (Podcast),"Editors' PickBehind The IdeaTue, Nov. 06, 201812 Comments"
"The Bear's FANGs Clench, And He's Starting With Amazon","Sunil ShahMon, Nov. 05, 2018122 Comments"
Amazon: Was It Really That Bad?,"Bert HochfeldFri, Nov. 02, 201875 Comments"
Amazon Isn't Just A Bet On A Premise Anymore,"James BrumleyFri, Nov. 02, 201839 Comments"
4 Reasons I Just Tripled My Position In Amazon,"Dividend SenseiThu, Nov. 01, 2018369 Comments"
Amazon: Crash Protection Kicks In,"David PinsenWed, Oct. 31, 201817 Comments"
25% Off At Amazon.com,"Bespoke Investment GroupWed, Oct. 31, 201857 Comments"
Should You Buy Amazon On The Dip?,"Sankalp SoniTue, Oct. 30, 2018106 Comments"
Amazon's Guidance: Better Than The Headlines,"Billy DubersteinTue, Oct. 30, 201829 Comments"
Amazon: The $250-Billion Drop,"Bill MaurerMon, Oct. 29, 2018113 Comments"
Will Amazon's Fourth Quarter Have Moderate Revenue And High Earnings?,"Edward AmbroseMon, Oct. 29, 201838 Comments"
Amazon: Growth Days Are Gone,"Michael Wiggins De OliveiraMon, Oct. 29, 2018210 Comments"
Amazon Is What Worries Me About The Market,"Victor DergunovSun, Oct. 28, 2018265 Comments"
Is Amazon The REIT Hedge?,"Arturo Neto, CFASat, Oct. 27, 201874 Comments"
Amazon Earnings: What's Next?,"Income GeneratorWed, Oct. 24, 201844 Comments"
Amazon Likely To Surprise To The Upside On Thursday,"D. H. TaylorTue, Oct. 23, 201884 Comments"
"Amazon: Undervalued Till $3,000","Oleh KombaievTue, Oct. 23, 201840 Comments"
Amazon Go - A Blessing Or A Political Nightmare,"Nicholas MushaikeThu, Oct. 18, 201838 Comments"
This Is No Bubble: Amazon Is A Strong Buy,"Julian LinTue, Oct. 16, 2018172 Comments"
Amazon's Undervalued Potential,"Long Term TipsMon, Oct. 15, 201830 Comments"
Who Needs The Facebook Portal And Portal+ Devices?,"Crispus NyagaWed, Oct. 10, 201859 Comments"
Buy Amazon On The Pullback,"Mark RoussinWed, Oct. 10, 2018160 Comments"
Riding The Amazon Wave All The Way Home,"Arturo Neto, CFAWed, Oct. 10, 201819 Comments"
Amazon's Focus On High Standards - Does It Matter For Investors? (Podcast),"Editors' PickBehind The IdeaTue, Oct. 09, 20185 Comments"
Amazon: Selling The Dream,"Michael Wiggins De OliveiraMon, Oct. 08, 201859 Comments"
Amazon's Savvy Pay Raise,"David PinsenWed, Oct. 03, 201862 Comments"
Amazon Creating Global Cloud Service With Iridium,"Long Term TipsTue, Oct. 02, 201846 Comments"
Why Amazon And Alibaba Need Each Other,"The Growth GuyTue, Oct. 02, 201822 Comments"
Should Amazon Worry About Massive Online Growth Of Target And Walmart?,"Bluesea ResearchTue, Oct. 02, 201839 Comments"
Amazon: 2 Clear Reasons To Stay Long,"Taylor DartMon, Oct. 01, 201846 Comments"
6 Reasons I Just Bought Amazon (The Only Non-Dividend Stock I Plan To Own),"Editors' PickDividend SenseiMon, Oct. 01, 2018561 Comments"
Amazon Goes Truly Global With Iridium Communications,"Daniel JonesMon, Oct. 01, 201828 Comments"
Amazon: A Bargain Or Irrational Exuberance?,"D. H. TaylorMon, Oct. 01, 201835 Comments"
Technology: Where's The Tipping Point?,"Editors' PickSA MarketplaceFri, Sep. 28, 201853 Comments"
Amazon: Stay Clear,"Michael Wiggins De OliveiraWed, Sep. 26, 2018220 Comments"
"Amazon Has $7.9 Billion Reasons To Buy 20,000 Vans","Michael HenageTue, Sep. 25, 201830 Comments"
Amazon Ads: The Next Big Thing?,"Michael A. BallTue, Sep. 25, 201827 Comments"
Amazon: The $940 Billion Startup That Cannot Be Accurately Valued,"Nicholas MushaikeMon, Sep. 24, 201830 Comments"
Podcast: Amazon 2018 Product Launch Event,"Bob O'DonnellMon, Sep. 24, 2018"
Amazon And Apple At A Trillion Dollar: A Follow-Up On Uncertainty And Catalysts,"Aswath DamodaranSat, Sep. 22, 201851 Comments"
Alibaba Vs. Amazon: A Simple Choice,"The Growth GuyFri, Sep. 21, 2018198 Comments"
Whatever They Told You About The Recent Amazon Share Rally Is Wrong - This Chart Shows Why,"FinalytiksThu, Sep. 20, 201884 Comments"
Amazon May Have A Vestager Problem,"From Growth to ValueThu, Sep. 20, 201849 Comments"
Apple And Amazon At A Trillion Dollar: Looking Back And Looking Forward,"Aswath DamodaranThu, Sep. 20, 201853 Comments"
Should You Still Purchase Amazon At This Level?,"Sandeep Singh AhluwaliaTue, Sep. 18, 201829 Comments"
Amazon's Big Step Into IoT,"Daniel JonesTue, Sep. 18, 20184 Comments"
Amazon's Healthcare Strategy Takes Shape,"John EngleWed, Sep. 12, 201825 Comments"
Amazon Vs. McKesson And Its Pharma Distribution Peers,"OyatWed, Sep. 12, 201825 Comments"
"At This Level, Does Amazon Stock Make Sense?","Rob MarstrandWed, Sep. 12, 201855 Comments"
Should You Be Buying Amazon?,"Michael Wiggins De OliveiraWed, Sep. 12, 201847 Comments"
Amazon: 5 Reasons To Avoid This Stock,"Robert RiesenMon, Sep. 10, 201892 Comments"
The Risk/Reward Of Owning A $1 Trillion Amazon Is Terrible,"Healthy Wealth CoachSun, Sep. 09, 2018130 Comments"
Amazon Will Rapidly Improve Margins Through Lower Online Store Sales,"Bluesea ResearchSat, Sep. 08, 201835 Comments"
"At This Valuation, Investors Should Think Critically Rather Than Rejoice","Paul Nouri, CFPThu, Sep. 06, 201866 Comments"
"Amazon Is More Overvalued Than Nvidia: 126.19 Price To Free Cash Flow, 45.76 Price To Operating Cash Flow","Geoffrey CaveneyTue, Sep. 04, 2018136 Comments"
Amazon: Buying An Umbrella When It's Sunny Out,"David PinsenThu, Aug. 30, 201852 Comments"
Amazon's AWS Faces Another Threat,"Bluesea ResearchWed, Aug. 29, 201849 Comments"
Apple Vs. Amazon: The Right Choice Is Simple,"Robert RiesenWed, Aug. 29, 2018333 Comments"
Amazon: $2 Trillion By 2020?,"DM Martins ResearchWed, Aug. 29, 2018107 Comments"
Amazon: Valuation Update After Quarterly Results,"Oleh KombaievTue, Aug. 28, 201866 Comments"
