Amazon's AWS About To Grow 45%+ And Just Killed The X86 Processor - Watch Out Intel And AMD,"Andrew SatherWed, Aug. 1999 Comments"
Amazon: Less Overvalued Than Others,"Oleh KombaievWed, Aug. 1921 Comments"
"How Adam Smith Might Have Valued Amazon, Netflix, Tesla, And Tiny Biotechs","Editors' PickJim SloanMon, Aug. 1051 Comments"
An ETF For Every Theme: COVID-19 Lightning Round With Global X (Podcast Transcript),"Lets Talk ETFsSun, Aug. 09"
"Amazon: Blowout Quarter, Path To $2 Trillion Underway","MangoTree AnalysisWed, Aug. 0551 Comments"
"Amazon: Still A High Growth Company, Still Cheap","Michael Wiggins De OliveiraTue, Aug. 0479 Comments"
Amazon's Blowout Quarter: It Is Not Too Late To Buy,"Andres Cardenal, CFAMon, Aug. 0351 Comments"
Amazon Crushes It Again,"Bill MaurerMon, Aug. 0327 Comments"
"Amazon: Why The Stock Price Could Soon Rise To $5,000","Güner SoysalMon, Aug. 03127 Comments"
Amazon Earnings Review: $2 Trillion Is Inevitable,"DM Martins ResearchFri, Jul. 3185 Comments"
An ETF For Every Theme: COVID-19 Lightning Round With Global X (Podcast),"Lets Talk ETFsThu, Jul. 306 Comments"
Amazon Earnings Preview: Buy And Tuck Away,"DM Martins ResearchThu, Jul. 30115 Comments"
"Amazon: Go Long Into Q2 Earnings, Here's Why","Michael Wiggins De OliveiraMon, Jul. 2792 Comments"
Where Could Amazon Invest $5.5 Billion In India?,"High Watermark InvestmentsFri, Jul. 1724 Comments"
Online Shopping Scams: Another Bullish Factor For Amazon,"Francisco Javier GarciaThu, Jul. 1662 Comments"
Fed Liquidity Trumps Rising Covid Worry - Marc Chaikin Joins Alpha Trader,"Alpha TraderTue, Jul. 1413 Comments"
Amazon: 3 Reasons Why The Stock Doubled And Whether There's Still Upside Left,"Robbe DelaetMon, Jul. 1371 Comments"
Walgreens: A Prime Candidate For Amazon,"Gen AlphaWed, Jul. 08156 Comments"
Amazon Could Change The Logistics Game With Zoox Acquisition,"Editors' PickEnerTuitionTue, Jul. 0732 Comments"
Amazon Enters The Competition For Autonomous Ride Services,"Michael McGrathWed, Jul. 01138 Comments"
Amazon Vs. Facebook: Battleground India,"Vishesh RaisinghaniThu, Jun. 2526 Comments"
Amazon's Bull Run May Be Near Its End,"Mott Capital ManagementWed, Jun. 24100 Comments"
Amazon: Why We Think There's Earnings Upside,"Alberto WallisWed, Jun. 2422 Comments"
Doubling Down On Amazon: My FAAMG Pick For The Rest Of 2020,"DM Martins ResearchWed, Jun. 2436 Comments"
Amazon: The 'Other' Segment May Be Worth More Than AWS,"Louis StevensTue, Jun. 2393 Comments"
Amazon Looking To Beat Apple And Microsoft To $2tn Market Capitalization,"Insider MonkeyFri, Jun. 1936 Comments"
Amazon: A New Narrative Is About To Unfold,"Michael Wiggins De OliveiraFri, Jun. 19117 Comments"
Amazon: Still The Best Growth Stock To Buy,"Khaveen InvestmentsWed, Jun. 1711 Comments"
Amazon: Here's What You Should Be Monitoring,"Louis StevensMon, Jun. 08106 Comments"
Why Amazon Is A Buy Amidst COVID-19,"Cash-Centered CreepSun, Jun. 0740 Comments"
Amazon: What A Bond Deal,"Bill MaurerThu, Jun. 0437 Comments"
Amazon Faces A Brand New World,"ValuentumThu, May 2818 Comments"
"Amazon's Biggest Earner, And It's Not AWS","Robert HoneywillThu, May 2853 Comments"
The Case For Alibaba Over Amazon,"Editors' PickALT PerspectiveSun, May 24412 Comments"
Amazon's Foray Into Gaming Provides A Huge Opportunity To Boost Prime Memberships,"Lukas WolgramThu, May 2159 Comments"
Amazon: Be Careful What You Wish For,"Adam Levine-Weinberg CFAThu, May 21105 Comments"
Amazon: New High Seems Inevitable,"Bill MaurerMon, May 1847 Comments"
Amazon Has Not Won Yet,"The Value TrendWed, May 1379 Comments"
"SWAN: Protecting Your Portfolio From Black Swans, COVID-19 Edition (Podcast Transcript)","Lets Talk ETFsWed, May 137 Comments"
Path To $2600 Is The Worst-Case Scenario For Amazon,"Oleh KombaievWed, May 1369 Comments"
"The Reasons Behind The Rally, And The Coming Inflation - Cullen Roche Talks With Alpha Trader (Podcast)","Alpha TraderTue, May 128 Comments"
"Amazon: Raising PT From $1,920 To $2,740","MangoTree AnalysisFri, May 08107 Comments"
Is Amazon Too Big To Fail?,"Sramana MitraWed, May 0652 Comments"
The FAANGs Reported Earnings Last Week: Valuation Implications And Recommendations,"Thomas LottTue, May 0587 Comments"
"Amazon: Still Delivering Strong Growth, Still Cheaply Valued","Michael Wiggins De OliveiraTue, May 0519 Comments"
"Amazon Post-Earnings: Forward Revenue Estimates Raised, EPS Crushed As Investment Cycle Continues","Brian Gilmartin, CFAMon, May 0419 Comments"
Amazon Earnings: Take A Seat And Relax,"Zen AnalystMon, May 0421 Comments"
Amazon.com: Hard To Justify,"The Value InvestorMon, May 0435 Comments"
Amazon: Buy The Dips,"Ishan PuriMon, May 0444 Comments"
"Amazon: Huge AWS Growth Potential, Could Be Worth $4,900 By 2024","Anh HoangSun, May 0380 Comments"
Netflix And IBM Earnings Are A Clear Negative Read-Across To Amazon Web Services,"Keuka CapitalThu, Apr. 23184 Comments"
Amazon Will Become A Video Game Juggernaut,"Ash AndersonTue, Apr. 2192 Comments"
Amazon: Measuring Free Cash Flow,"The Profit HunterFri, Apr. 1739 Comments"
"Amazon: All-Time High, But Still On Sale","James BoniferWed, Apr. 15279 Comments"
Amazing Amazon: The Benefits Of Having This Company In Your Portfolio,"The European ViewMon, Apr. 1324 Comments"
"Amazon: Two Sides Of The Story, Always","Michael Wiggins De OliveiraMon, Apr. 1343 Comments"
50% Y/Y Sales Growth And Rapid Retail Expansion Could Be Just The Start For Amazon,"Trent WelshMon, Apr. 1336 Comments"
Amazon Shares Seem Pretty Rich As Impact On AWS Is Being Overlooked,"Mark RoussinWed, Apr. 08140 Comments"
Amazon And Earnings,"Damon VerialTue, Apr. 0731 Comments"
FAANG Stocks: Making 5 Short-Term Technical Calls Ahead Of Q1 Earnings,"Alexander VeytsmanTue, Apr. 0740 Comments"
Amazon Just Walk Out: Just In Time For Post-COVID-19 Shopping Era,"The Battle Of GiantsTue, Apr. 073 Comments"
Amazon's Pristine Financials Give It The Firepower To Ramp Up To Meet Demand,"ValuentumThu, Apr. 0217 Comments"
The Market Is Underestimating Coronavirus' Impact On Amazon,"Keuka CapitalMon, Mar. 30156 Comments"
Amazon Is Providing Flexibility,"Eric SpragueMon, Mar. 309 Comments"
'No Way To Value Equities' - Jeff Macke Talks With Alpha Trader (Podcast Transcript),"Alpha TraderSun, Mar. 2918 Comments"
Amazon: Low Downside Potential,"Oleh KombaievWed, Mar. 2541 Comments"
'No Way To Value Equities' - Jeff Macke Talks With Alpha Trader,"Alpha TraderTue, Mar. 2418 Comments"
Amazon's Next Billion-Dollar Business,"Ash AndersonSun, Mar. 22139 Comments"
Billionaires In The Time Of Covid-19,"Chris DeMuth Jr.Fri, Mar. 20145 Comments"
Amazon Could Be The Ultimate Opportunity In This Market Crash,"Vishesh RaisinghaniFri, Mar. 2064 Comments"
Amazon: The Real Opportunity,"Bill MaurerWed, Mar. 1848 Comments"
"Amazon: Coronavirus Boosting Retail, But Bearish For AWS","BOOX ResearchWed, Mar. 1834 Comments"
Chinese Internet Stocks Are A Better Bet Amid COVID-19,"Editors' PickALT PerspectiveMon, Mar. 16154 Comments"
The Data-Driven Approach To Finding Investment Ideas (Podcast Transcript),"SA Marketplace Roundtable PodcastMon, Mar. 029 Comments"
Unpopular Opinion: Amazon Is Undervalued,"Andres Cardenal, CFAThu, Feb. 2742 Comments"
Why Google Should Be Afraid Of Amazon,"Francisco Javier GarciaThu, Feb. 2763 Comments"
"Amazon: AWS Key Driver Of Upside, Why This Matters","Michael Wiggins De OliveiraTue, Feb. 2537 Comments"
Alpha Trader Talks 'New Paradigm' Tech With Mark Hibben (Podcast),"Alpha TraderTue, Feb. 255 Comments"
The Data-Driven Approach To Finding Investment Ideas (Podcast),"SA Marketplace Roundtable PodcastTue, Feb. 25"
2020 Will Be Amazon's Comeback Year,"DM Martins ResearchSun, Feb. 2353 Comments"
"Amazon: $2,500 As A First Target","Oleh KombaievThu, Feb. 2069 Comments"
Amazon Might Break Up And That's A Good Thing,"Louis StevensTue, Feb. 1850 Comments"
Amazon's Recent Rally May Only Be The Start,"Mott Capital ManagementWed, Feb. 1262 Comments"
We're Moving To Neutral On Amazon - Just Like Jeff Bezos,"Cestrian Capital ResearchMon, Feb. 1087 Comments"
Amazon Looks To India For Next Round Of E-Tail Growth,"Sramana MitraTue, Feb. 0412 Comments"
Amazon: Here We Go Again,"Graham GriederTue, Feb. 0425 Comments"
A Prime Reason To Applaud Amazon,"Daniel JonesMon, Feb. 0310 Comments"
Amazon: More Room To Run Based On Accelerated Growth,"Güner SoysalMon, Feb. 0326 Comments"
Amazon: Why I'm Now More Bullish Than Ever,"Michael Wiggins De OliveiraFri, Jan. 3173 Comments"
Amazon: One Of The Best Long-Term Investment In The Tech Sector,"Francisco Javier GarciaFri, Jan. 3132 Comments"
Amazon: Accelerating Decline In Shipping Costs Are Driving Future Valuation,"Luke McCarthyThu, Jan. 3020 Comments"
"Amazon: You Can Do Better, Here's Why","Michael Wiggins De OliveiraWed, Jan. 2279 Comments"
Microsoft Vs. Amazon: Valuing The Cloud,"Louis StevensFri, Jan. 1795 Comments"
Amazon: An 'Ida Tarbell' Moment Awaits For This Tech Giant,"Editors' PickFluidsdocWed, Jan. 1567 Comments"
Amazon's Efficiency Is A Big Reason To Buy,"The European ViewTue, Jan. 1445 Comments"
Amazon Stock And Free Cash Flow Benefit In The Long Run From Its Huge Spending,"Mark HakeMon, Jan. 1319 Comments"
"Out With Apple, In With Amazon: My Favorite FAANG Stock For 2020","DM Martins ResearchSun, Jan. 1253 Comments"
Amazon: 2020 Valuation Outlook,"Kwan-Chen MaMon, Jan. 0639 Comments"
Amazon: Why Corporate America's Future 'King Of Revenue' Is A Must-Have In The Decade Ahead,"Güner SoysalMon, Jan. 0632 Comments"
A Thesis Revisit On Alibaba And Tencent Might Surprise You,"Editors' PickALT PerspectiveMon, Dec. 30, 201997 Comments"
"Melt-Up Alert: Amazon Finally Leading, Let's See What Other Tech Names Are Going To Lead","David H. LernerFri, Dec. 27, 201979 Comments"
Now Is The Right Time To Buy Amazon,"Andres Cardenal, CFAThu, Dec. 26, 2019119 Comments"
AWS And Azure: Racing For The Best Business Opportunity Of The 21st Century,"The Stock StoogeMon, Dec. 23, 2019121 Comments"
Amazon's Stock May Rally Into Fourth Quarter Results,"Mott Capital ManagementMon, Dec. 23, 201916 Comments"
Tech Is Just Getting Started Going Into 2020,"Editors' PickSA MarketplaceMon, Dec. 23, 2019119 Comments"
Amazon's Moat Weakens,"Michael Wiggins De OliveiraWed, Dec. 18, 201974 Comments"
"Amazon's Revenue To Double By 2023 Driven By AWS, Ads, And Prime.","Nikolaos SismanisSun, Dec. 15, 201974 Comments"
Amazon: Better For Longer,"AltimetrySun, Dec. 15, 201910 Comments"
Amazon Fires Back At Microsoft And Alphabet With A Huge Win In Gaming Live Streaming,"Lukas WolgramFri, Dec. 13, 201917 Comments"
Amazon: More Downside Into 2020,"BOOX ResearchWed, Dec. 11, 201985 Comments"
Amazon Steps Up The Processor Wars,"Trading Places ResearchMon, Dec. 09, 201951 Comments"
Intel's And Nvidia's Margin Is Amazon's Opportunity,"EnerTuitionThu, Dec. 05, 201955 Comments"
Amazon Prime Reveals A Big Success,"Bluesea ResearchThu, Dec. 05, 201961 Comments"
"Amazon's Graviton2 CPU: This Time, It's For Real","Paulo SantosTue, Dec. 03, 201962 Comments"
Amazon: One Company To Deflate Them All,"Cestrian Capital ResearchMon, Dec. 02, 201980 Comments"
Amazon's Short-Term Challenges Are A Gift Investors Can Unwrap Now,"Michael HenageWed, Nov. 27, 201925 Comments"
Amazon Reveals A Challenging Trend,"Bluesea ResearchWed, Nov. 27, 201923 Comments"
"Melt-Up Alert: Amazon Rises, Intel Hurts Dell, HP But Helps AMD, And Deere Likely Phase One Winner","David H. LernerWed, Nov. 27, 201972 Comments"
Amazon Gains Pricing Advantage Over Walmart And Target During Black Friday Shopping Season,"Bluesea ResearchTue, Nov. 26, 201930 Comments"
There's No Undervaluation Of Amazon,"Oleh KombaievTue, Nov. 26, 201935 Comments"
The Best Managed Companies Of 2019,"John M. MasonTue, Nov. 26, 201978 Comments"
Amazon: The Bull Is Back,"Mott Capital ManagementMon, Nov. 25, 201920 Comments"
Amazon: Unstoppable,"Michael A. Gayed, CFAThu, Nov. 21, 201960 Comments"
Amazon: Looking Beyond Basics,"Michael Wiggins De OliveiraTue, Nov. 19, 201921 Comments"
Amazon: Entering Buy Territory,"Robert HoneywillTue, Nov. 19, 201930 Comments"
Amazon: Finally At A Reasonable Price,"Mauro SolisFri, Nov. 15, 201950 Comments"
High Conviction Buy: Amazon Is A Must-Own Growth Machine,"Julian LinWed, Nov. 13, 2019147 Comments"
Amazon's Next Growth Driver Will Be Bigger Than AWS,"Bluesea ResearchTue, Nov. 12, 201936 Comments"
Amazon Could Use An AWS Boost,"Bill MaurerMon, Nov. 11, 201918 Comments"
Amazon: Investor Concerns Are Real; Fears Are Overblown,"Value To SuccessThu, Nov. 07, 201915 Comments"
Amazon: You Can Do Better,"Michael Wiggins De OliveiraWed, Nov. 06, 201953 Comments"
"Amazon, A Growth Story With 34% Downside","James MaseWed, Nov. 06, 201963 Comments"
Amazon's Edge In Edge Computing Can Be Blunted By The Telecom Carriers,"Shareholders UniteTue, Nov. 05, 20195 Comments"
Amazon: Getting Warmer On Payment,"Terracotta InvestmentsWed, Oct. 30, 201924 Comments"
Amazon: Amazing Company (Poor Stock),"Michael Wiggins De OliveiraMon, Oct. 28, 201941 Comments"
Amazon: A Lot To Like Here,"Terracotta InvestmentsMon, Oct. 28, 201920 Comments"
Amazon: Steady Is Not Good Enough,"The Value InvestorMon, Oct. 28, 201927 Comments"
Third Quarter For Amazon And The Longer Run,"John M. MasonFri, Oct. 25, 201927 Comments"
Mighty Amazon Is Falling; Let's See How Far. Also Some Chips Are Chipper Because Of IT And Datacom,"David H. LernerFri, Oct. 25, 201967 Comments"
Amazon: We Have A Problem,"Bill MaurerThu, Oct. 24, 2019195 Comments"
Amazon's Stock Will Need AWS To Deliver,"Mott Capital ManagementWed, Oct. 23, 201914 Comments"
Amazon Earnings Preview: Q2 EPS Miss Has Investors Thinking An 'Investment Cycle' Is At Hand,"Brian Gilmartin, CFATue, Oct. 22, 201920 Comments"
"The 'Empire Strikes Back'; Why FANG Isn't Leading, And What It Can Do Right Now","David H. LernerFri, Oct. 18, 201946 Comments"
Amazon: Horizontal Expansion Into Groceries,"Editors' PickStrategyDocThu, Oct. 17, 201952 Comments"
Amazon Can't Resist To Grow Market Share,"Kwan-Chen MaWed, Oct. 02, 201965 Comments"
Amazon: Short-Term Weakness And Long-Term Opportunity,"Andres Cardenal, CFAThu, Sep. 26, 201920 Comments"
Amazon Makes Massive Cuts In Whole Foods' Prices,"Bluesea ResearchTue, Sep. 24, 201957 Comments"
Look Past The Short-Term: Amazon Still Has Plenty Of Growing To Do,"Cash-Centered CreepTue, Sep. 24, 20198 Comments"
Amazon's Aggressive Discounts Get Strong Response,"Bluesea ResearchWed, Sep. 18, 201920 Comments"
Amazon: For Buy And Hold Shareholders,"Michael Wiggins De OliveiraWed, Sep. 18, 201931 Comments"
Amazon Declares A Major Win As Rivals Back Down,"Bluesea ResearchMon, Sep. 16, 201930 Comments"
"Amazon Needs Workers: The ""New"" Modern Corporation","John M. MasonTue, Sep. 10, 201966 Comments"
A New Reason To Buy Amazon And No One Noticed,"The European ViewMon, Sep. 09, 2019138 Comments"
Amazon: The Trading Signal,"Michael A. Gayed, CFAThu, Sep. 05, 201924 Comments"
Amazon Looking To Dethrone Apple In The Music Business,"Bluesea ResearchThu, Sep. 05, 201928 Comments"
Amazon's Next Move May Be Starting,"Mott Capital ManagementFri, Aug. 30, 201927 Comments"
Breach At Capital One Bolsters The Case For Oracle,"High Watermark InvestmentsFri, Aug. 30, 201963 Comments"
Amazon: Advertising Strong Future Growth,"Michael HenageThu, Aug. 29, 201912 Comments"
Amazon: Fundamental Valuation Update,"Oleh KombaievTue, Aug. 20, 201939 Comments"
Investing In 'Best Of Breed' With Julian Lin (Podcast),"SA Marketplace Roundtable PodcastMon, Aug. 19, 201918 Comments"
A Share Buyback Is Coming: Amazon Is A Conviction Buy,"Julian LinTue, Aug. 13, 2019162 Comments"
Amazon: No Bottom Here,"Oleh KombaievFri, Aug. 09, 201993 Comments"
Valuating Amazon's Big Move Into Automotive Data Monetization,"The European ViewWed, Aug. 07, 201939 Comments"
Amazon Should Repurpose GameStop To Prime Stores,"Paul FrankeWed, Aug. 07, 201956 Comments"
Amazon Sends Users Dashing Toward Alexa,"Michael HenageMon, Aug. 05, 20198 Comments"
Amazon Sacrifices For Long-Term Growth,"Edward AmbroseMon, Aug. 05, 201923 Comments"
Amazon: A Future 'Storm-Resistant' Growth Stock,"DM Martins ResearchMon, Aug. 05, 201936 Comments"
"Challenges Ahead Might Slow Amazon, Not Derail Its Ascension","Value To SuccessMon, Aug. 05, 20197 Comments"
Amazon's Recent Declines May Only Be The Start,"Mott Capital ManagementThu, Aug. 01, 201936 Comments"
Should Amazon Remain One Company?,"Sramana MitraThu, Aug. 01, 201923 Comments"
3 Reasons Amazon Still Belongs In Your Portfolio For The Long Term,"Mark RoussinThu, Aug. 01, 201912 Comments"
Amazon: Don't Buy The Dip,"James MaseWed, Jul. 31, 201992 Comments"
Amazon Offers A Rare Buying Opportunity,"Michael HenageTue, Jul. 30, 201941 Comments"
Amazon: A Bearish Case Emerges Post Earnings,"BOOX ResearchTue, Jul. 30, 201961 Comments"
Amazon's Battle With Walmart Shows A Major Shift,"Bluesea ResearchThu, Jul. 25, 201955 Comments"
Amazon's Earnings: Time To Push Through Record Highs,"DM Martins ResearchTue, Jul. 23, 201922 Comments"
A Not Well Targeted Shot On The Amazon Business,"Editors' PickThe European ViewFri, Jul. 19, 201925 Comments"
Amazon's Slowing Growth May Sink The Stock Following Results,"Mott Capital ManagementThu, Jul. 18, 201970 Comments"
Amazon: Growth Economics And Satellite Broadband,"Abrar Hassan SaadiTue, Jul. 16, 201913 Comments"
Amazon's Effort To Retrain: Time Pacing Hits The Labor Force,"John M. MasonFri, Jul. 12, 201941 Comments"
Amazon: New Highs Coming,"Elazar Advisors, LLCTue, Jul. 09, 2019117 Comments"
Amazon Is Still A Startup,"Oleh KombaievMon, Jul. 08, 201941 Comments"
Amazon And Rite Aid Move A Little Bit Closer,"Daniel JonesMon, Jul. 08, 2019215 Comments"
Antitrust Insurance For Amazon,"David PinsenSun, Jul. 07, 201922 Comments"
The P/E For Amazon Is Not The Full Story,"Eric SpragueMon, Jul. 01, 201958 Comments"
Amazon's Next Big Thing,"Daniel JonesThu, Jun. 27, 201943 Comments"
Apple Is Better Prepared For The Doom And Gloom Scenario Than Amazon,"The European ViewThu, Jun. 27, 201934 Comments"
Amazon And Shopify: 'Coopetition' At Its Best,"Ramy Taraboulsi, CFAFri, Jun. 21, 2019134 Comments"
Barnes & Noble Takeover Shows Retail Theme Is Technology Change,"Anne Anderson, CFAFri, Jun. 21, 201914 Comments"
Amazon Is An Undervalued Growth Company And Has Another AWS Up Its Sleeve,"Freyr CapitalFri, Jun. 21, 2019124 Comments"
Amazon: Is Past Prologue?,"Carlton Getz, CFAThu, Jun. 20, 201986 Comments"
Amazon Works To Beef Up The Ecosystem: Lending,"John M. MasonMon, Jun. 17, 201915 Comments"
Amazon Needs To Compete Against Asia's Richest Person (It's Not Alibaba's Jack Ma),"Bluesea ResearchMon, Jun. 17, 20197 Comments"
Amazon Is Betting Big On Satellite Internet,"John EngleWed, Jun. 12, 201948 Comments"
Amazon: Impact Of Increasing Rivalry With FedEx,"Bluesea ResearchMon, Jun. 10, 201921 Comments"
Amazon: Dig Deeper,"Oleh KombaievThu, Jun. 06, 201932 Comments"
Amazon: Firing On All Cylinders,"Gainsboro CapitalSun, Jun. 02, 201957 Comments"
Amazon Does Not Command A Presence In Ticketing Live Events,"The European ViewSun, Jun. 02, 201926 Comments"
Amazon Will Grow Faster In 2023 Than Today,"Michael HenageFri, May 31, 201963 Comments"
Amazon Makes A Big Splash In Travel Industry,"Bluesea ResearchThu, May 30, 201913 Comments"
Amazon's Stock May Be About To Turn Around,"Mott Capital ManagementWed, May 29, 201925 Comments"
Embrace Uncertainty: Apple Vs. Amazon,"Peter F. Way, CFATue, May 28, 201936 Comments"
Whether Amazon Is Under Threat From Walmart And Target's Online Growth,"Bluesea ResearchFri, May 24, 201932 Comments"
Amazon's Revenue Slowdown Provides A Big Opportunity,"Bluesea ResearchWed, May 22, 201943 Comments"
Amazon: Using Price-To-Sales As A Technical Oscillator (Video),"Stock WavesWed, May 22, 201911 Comments"
Amazon: Valuation Update,"Oleh KombaievMon, May 20, 201912 Comments"
More Data On Amazon's Advertising Business,"Oleh KombaievSat, May 18, 201922 Comments"
What First Quarter Earnings Mean For Amazon Investors,"Damon VerialWed, May 15, 201912 Comments"
"Masters Of Cloud, Part 2: The Evolving Landscape","Editors' PickHigh Watermark InvestmentsMon, May 13, 201957 Comments"
Amazon: Strong Buy For Value And Growth Not Buffett's Purchase,"Steven FiorilloWed, May 08, 201938 Comments"
"Masters Of Cloud, Part 1: The Players","High Watermark InvestmentsMon, May 06, 201949 Comments"
Amazon: Leader In The Cloud Computing Space,"Greenwood InvestmentsSun, May 05, 201914 Comments"
"Is Amazon Leaving China, Or Not?","Doug YoungFri, Apr. 26, 201936 Comments"
Amazon: Fails To Impress,"Michael Wiggins De OliveiraFri, Apr. 26, 2019217 Comments"
Amazon: Quantitative Valuation,"Oleh KombaievThu, Apr. 25, 201918 Comments"
Amazon Earnings Preview: The Most Disruptive Company In America Today?,"Brian Gilmartin, CFAWed, Apr. 24, 201920 Comments"
Amazon Is Breaking Out Ahead Of Results,"Mott Capital ManagementTue, Apr. 23, 201914 Comments"
The Amazon Jungle Continues To Grow,"Arturo Neto, CFAFri, Apr. 19, 201947 Comments"
Why Microsoft Remains A Better Buy Over Amazon,"Robert RiesenWed, Apr. 17, 201952 Comments"
Why I Own Amazon Stock For The Long Term,"Andres Cardenal, CFAWed, Apr. 17, 201921 Comments"
Amazon: Pressure On Whole Foods?,"Michael BoydTue, Apr. 09, 201949 Comments"
Amazon In Risk Zone Part 3,"Oleh KombaievMon, Apr. 08, 201926 Comments"
Amazon Shares Are Headed Higher From Here,"MangoTree AnalysisMon, Apr. 08, 201939 Comments"
Amazon: Buy If You Can Handle The Risk,"James BoniferTue, Apr. 02, 201932 Comments"
'ABC Healthcare' Not Ready To Break The Mold,"Rogier van VlissingenMon, Mar. 25, 201996 Comments"
"Amazon, Netflix, Apple, Disney Or AT&T: A Surprising Winner In The Streaming Service","Bluesea ResearchFri, Mar. 22, 2019156 Comments"
Amazon's Breakout May Fuel A Return To Its All-Time Highs,"Mott Capital ManagementWed, Mar. 20, 201925 Comments"
In The Clouds: The 2019 IPO Market Is Dependent On AWS,"Kyla ScanlonTue, Mar. 19, 201920 Comments"
Amazon In Risk Zone Part 2,"Oleh KombaievMon, Mar. 18, 201926 Comments"
Amazon In Risk Zone,"Oleh KombaievThu, Mar. 14, 201940 Comments"
Amazon: AI And The $10 Trillion Healthcare Opportunity,"Zen AnalystWed, Mar. 13, 201984 Comments"
4 Reasons I Own Amazon And So Should You,"Dividend SenseiMon, Mar. 11, 2019157 Comments"
The Genius Way Amazon Finance Its Growth,"Alexander JohanssonThu, Mar. 07, 201947 Comments"
Amazon: It Looks Like Day 2,"Zen AnalystWed, Mar. 06, 201987 Comments"
Here's Why Amazon's Stock Faces Trouble,"Mott Capital ManagementTue, Mar. 05, 201980 Comments"
Amazon Moves Forward,"Douglas AdamsMon, Mar. 04, 201924 Comments"
Amazon: Digital Ads Won't Drive Stock,"Stone Fox CapitalThu, Feb. 28, 201942 Comments"
3 Reasons For Amazon To Reconsider Its Whole Foods Strategy,"Michael HenageTue, Feb. 26, 201992 Comments"
Amazon Vs. Alibaba: Changes In Cloud Market Can Throw A Big Surprise,"Bluesea ResearchMon, Feb. 25, 201935 Comments"
Amazon: Ignore Media Controversy And Focus On Fundamentals,"MangoTree AnalysisMon, Feb. 25, 20198 Comments"
The Good Business Portfolio Will Not Buy Amazon,"William StammWed, Feb. 20, 201935 Comments"
Amazon: Revenue Slowdown Is Not A Problem,"Bluesea ResearchWed, Feb. 20, 201915 Comments"
Growth Splutters With Amazon,"Michael Wiggins De OliveiraTue, Feb. 19, 201949 Comments"
More Accounting Games At Amazon,"Dave KranzlerTue, Feb. 19, 201931 Comments"
Amazon: The Most Undervalued Company Now,"Oleh KombaievFri, Feb. 15, 2019217 Comments"
Amazon's Promising Advertising Growth Story,"Callum TurcanMon, Feb. 11, 201923 Comments"
Why Amazon Is Undervalued,"Edward AmbroseFri, Feb. 08, 201977 Comments"
Amazon's Stock Is Facing Even Steeper Declines,"Mott Capital ManagementThu, Feb. 07, 201981 Comments"
"Amazon: Slower Growth, Great Operating Leverage","The Value InvestorMon, Feb. 04, 201918 Comments"
"Amazon: Poor Guidance, Again?","Michael Wiggins De OliveiraMon, Feb. 04, 201965 Comments"
Amazon Is Now A Slowing Growth Story,"Mott Capital ManagementFri, Feb. 01, 2019214 Comments"
Amazon Gains A Big Win As Rival Backs Down,"Bluesea ResearchWed, Jan. 30, 201957 Comments"
Amazon Makes A Decisive Change In Its Growth Strategy,"Bluesea ResearchTue, Jan. 29, 201963 Comments"
Why Amazon May Fall Following Results,"Mott Capital ManagementTue, Jan. 29, 201979 Comments"
Amazon: Unappreciated International Segment Turning The Corner,"BOOX ResearchMon, Jan. 28, 201916 Comments"
Amazon: 3rd Party Sellers Are Customers Too,"Robert HoneywillMon, Jan. 28, 201924 Comments"
Amazon Suffers A Big Setback,"Bluesea ResearchFri, Jan. 25, 201927 Comments"
Amazon: Momentum Is A 2-Way Street,"Robert HoneywillWed, Jan. 23, 201919 Comments"
Amazon Is Just Getting Started,"Louis StevensTue, Jan. 22, 201966 Comments"
Amazon: The Supplier Grinding Might Be Overdone,"Nelson AlvesFri, Jan. 18, 201942 Comments"
AWS (Amazon Web Services) Lacks Amazon-Like Margins,"Edward AmbroseWed, Jan. 16, 201926 Comments"
3 Reasons Why Amazon Bears Are Wrong,"Andres Cardenal, CFATue, Jan. 15, 201985 Comments"
Amazon: A Big Gamble,"Bluesea ResearchThu, Jan. 10, 201972 Comments"
Amazon Should Spin Off AWS Into A Separate Company,"D. H. TaylorThu, Jan. 10, 201940 Comments"
Amazon: The Competition Gets Jealous,"Michael Wiggins De OliveiraTue, Jan. 08, 2019108 Comments"
Amazon's 'Bezos The Great' Not Weeping Yet - Still More Worlds To Conquer,"Gary BourgeaultMon, Jan. 07, 201922 Comments"
Amazon: Perhaps Slower Growth But Huge Margin Expansion To Come,"Long Hill Road CapitalFri, Jan. 04, 201941 Comments"
Value Tough To Pin Down,"Editors' PickSA MarketplaceThu, Jan. 03, 201942 Comments"
"Retail Was Nice, Amazon Was Nicer","Sam WarrenFri, Dec. 28, 201810 Comments"
Indian Government's New Regulations: A Massive Blow For Amazon,"GS AnalyticsThu, Dec. 27, 2018100 Comments"
